{
  "schema_version": "1",
  "application_repository": "sentinel-projects/sentinel",
  "max_age_days": 30,
  "components": [
    {
      "id": "sentinel.runtime",
      "repository": "sentinel-projects/sentinel",
      "source_sha": "e639a0429baf35445daad84eb70a9d5e001cf082",
      "dirty": false,
      "dirty_digest": null,
      "required": false,
      "boundary": "Current application component; future repository split is not approved"
    },
    {
      "id": "sentinel.desktop",
      "repository": "sentinel-projects/sentinel",
      "source_sha": "e639a0429baf35445daad84eb70a9d5e001cf082",
      "dirty": false,
      "dirty_digest": null,
      "required": false,
      "boundary": "Current application component; future repository split is not approved"
    },
    {
      "id": "sentinel.terminal",
      "repository": "sentinel-projects/sentinel",
      "source_sha": "e639a0429baf35445daad84eb70a9d5e001cf082",
      "dirty": false,
      "dirty_digest": null,
      "required": false,
      "boundary": "Current application component; future repository split is not approved"
    },
    {
      "id": "sentinel.protocol",
      "repository": "sentinel-projects/sentinel",
      "source_sha": "e639a0429baf35445daad84eb70a9d5e001cf082",
      "dirty": false,
      "dirty_digest": null,
      "required": false,
      "boundary": "Current application component; future repository split is not approved"
    },
    {
      "id": "sentinel.extensions",
      "repository": "sentinel-projects/sentinel",
      "source_sha": "e639a0429baf35445daad84eb70a9d5e001cf082",
      "dirty": false,
      "dirty_digest": null,
      "required": false,
      "boundary": "Current application component; future repository split is not approved"
    },
    {
      "id": "sentinel.packaging",
      "repository": "sentinel-projects/sentinel",
      "source_sha": "e639a0429baf35445daad84eb70a9d5e001cf082",
      "dirty": false,
      "dirty_digest": null,
      "required": false,
      "boundary": "Current application component; future repository split is not approved"
    },
    {
      "id": "sentinel.verification",
      "repository": "sentinel-projects/sentinel",
      "source_sha": "e639a0429baf35445daad84eb70a9d5e001cf082",
      "dirty": false,
      "dirty_digest": null,
      "required": false,
      "boundary": "Current application component; future repository split is not approved"
    },
    {
      "id": "roasd.packaging",
      "repository": "sentinel-packaging",
      "source_sha": null,
      "dirty": false,
      "dirty_digest": null,
      "required": true,
      "boundary": "External packaging responsibility; actual repository location and version not supplied"
    }
  ],
  "criteria": [
    {
      "id": "AC-P0-01",
      "phase": "P0",
      "status": "Blocked",
      "source": "docs/roadmaps/ACCEPTANCE_MATRIX.md"
    },
    {
      "id": "AC-P0-02",
      "phase": "P0",
      "status": "Ready for Validation",
      "source": "docs/roadmaps/ACCEPTANCE_MATRIX.md"
    },
    {
      "id": "AC-P0-03",
      "phase": "P0",
      "status": "Blocked",
      "source": "docs/roadmaps/ACCEPTANCE_MATRIX.md"
    },
    {
      "id": "AC-P0-04",
      "phase": "P0",
      "status": "Blocked",
      "source": "docs/roadmaps/ACCEPTANCE_MATRIX.md"
    },
    {
      "id": "AC-P1-01",
      "phase": "P1",
      "status": "Unverified",
      "source": "docs/roadmaps/ACCEPTANCE_MATRIX.md"
    },
    {
      "id": "AC-P1-02",
      "phase": "P1",
      "status": "Blocked",
      "source": "docs/roadmaps/ACCEPTANCE_MATRIX.md"
    },
    {
      "id": "AC-P1-03",
      "phase": "P1",
      "status": "Blocked",
      "source": "docs/roadmaps/ACCEPTANCE_MATRIX.md"
    },
    {
      "id": "AC-P1-04",
      "phase": "P1",
      "status": "Ready for Validation",
      "source": "docs/roadmaps/ACCEPTANCE_MATRIX.md"
    },
    {
      "id": "AC-P1-05",
      "phase": "P1",
      "status": "Unverified",
      "source": "docs/roadmaps/ACCEPTANCE_MATRIX.md"
    },
    {
      "id": "AC-P1-06",
      "phase": "P1",
      "status": "Unverified",
      "source": "docs/roadmaps/ACCEPTANCE_MATRIX.md"
    },
    {
      "id": "AC-P1-07",
      "phase": "P1",
      "status": "Blocked",
      "source": "docs/roadmaps/ACCEPTANCE_MATRIX.md"
    },
    {
      "id": "AC-P2-01",
      "phase": "P2",
      "status": "Unverified",
      "source": "docs/roadmaps/ACCEPTANCE_MATRIX.md"
    },
    {
      "id": "AC-P2-02",
      "phase": "P2",
      "status": "Unverified",
      "source": "docs/roadmaps/ACCEPTANCE_MATRIX.md"
    },
    {
      "id": "AC-P2-03",
      "phase": "P2",
      "status": "Blocked",
      "source": "docs/roadmaps/ACCEPTANCE_MATRIX.md"
    },
    {
      "id": "AC-P2-04",
      "phase": "P2",
      "status": "Blocked",
      "source": "docs/roadmaps/ACCEPTANCE_MATRIX.md"
    },
    {
      "id": "AC-P3-01",
      "phase": "P3",
      "status": "Blocked",
      "source": "docs/roadmaps/ACCEPTANCE_MATRIX.md"
    },
    {
      "id": "AC-P3-02",
      "phase": "P3",
      "status": "Blocked",
      "source": "docs/roadmaps/ACCEPTANCE_MATRIX.md"
    },
    {
      "id": "AC-P3-03",
      "phase": "P3",
      "status": "Unverified",
      "source": "docs/roadmaps/ACCEPTANCE_MATRIX.md"
    },
    {
      "id": "AC-P4-01",
      "phase": "P4",
      "status": "Blocked",
      "source": "docs/roadmaps/ACCEPTANCE_MATRIX.md"
    },
    {
      "id": "AC-P4-02",
      "phase": "P4",
      "status": "Blocked",
      "source": "docs/roadmaps/ACCEPTANCE_MATRIX.md"
    },
    {
      "id": "AC-P4-03",
      "phase": "P4",
      "status": "Not Started",
      "source": "docs/roadmaps/ACCEPTANCE_MATRIX.md"
    },
    {
      "id": "AC-P5-01",
      "phase": "P5",
      "status": "Blocked",
      "source": "docs/roadmaps/ACCEPTANCE_MATRIX.md"
    },
    {
      "id": "AC-P5-02",
      "phase": "P5",
      "status": "Blocked",
      "source": "docs/roadmaps/ACCEPTANCE_MATRIX.md"
    },
    {
      "id": "AC-P5-03",
      "phase": "P5",
      "status": "Unverified",
      "source": "docs/roadmaps/ACCEPTANCE_MATRIX.md"
    },
    {
      "id": "AC-P5-04",
      "phase": "P5",
      "status": "Blocked",
      "source": "docs/roadmaps/ACCEPTANCE_MATRIX.md"
    },
    {
      "id": "AC-P5-05",
      "phase": "P5",
      "status": "Unverified",
      "source": "docs/roadmaps/ACCEPTANCE_MATRIX.md"
    },
    {
      "id": "AC-P6-01",
      "phase": "P6",
      "status": "Unverified",
      "source": "docs/roadmaps/ACCEPTANCE_MATRIX.md"
    },
    {
      "id": "AC-P6-02",
      "phase": "P6",
      "status": "Unverified",
      "source": "docs/roadmaps/ACCEPTANCE_MATRIX.md"
    },
    {
      "id": "AC-P6-03",
      "phase": "P6",
      "status": "Blocked",
      "source": "docs/roadmaps/ACCEPTANCE_MATRIX.md"
    },
    {
      "id": "AC-P6-04",
      "phase": "P6",
      "status": "Blocked",
      "source": "docs/roadmaps/ACCEPTANCE_MATRIX.md"
    },
    {
      "id": "AC-P6-05",
      "phase": "P6",
      "status": "Blocked",
      "source": "docs/roadmaps/ACCEPTANCE_MATRIX.md"
    },
    {
      "id": "AC-P6-06",
      "phase": "P6",
      "status": "Blocked",
      "source": "docs/roadmaps/ACCEPTANCE_MATRIX.md"
    },
    {
      "id": "AC-P6-07",
      "phase": "P6",
      "status": "Blocked",
      "source": "docs/roadmaps/ACCEPTANCE_MATRIX.md"
    },
    {
      "id": "AC-P6-08",
      "phase": "P6",
      "status": "Blocked",
      "source": "docs/roadmaps/ACCEPTANCE_MATRIX.md"
    },
    {
      "id": "AC-P7-01",
      "phase": "P7",
      "status": "Blocked",
      "source": "docs/roadmaps/ACCEPTANCE_MATRIX.md"
    },
    {
      "id": "AC-P7-02",
      "phase": "P7",
      "status": "Blocked",
      "source": "docs/roadmaps/ACCEPTANCE_MATRIX.md"
    },
    {
      "id": "AC-P8-01",
      "phase": "P8",
      "status": "Blocked",
      "source": "docs/roadmaps/ACCEPTANCE_MATRIX.md"
    },
    {
      "id": "AC-P8-02",
      "phase": "P8",
      "status": "Blocked",
      "source": "docs/roadmaps/ACCEPTANCE_MATRIX.md"
    },
    {
      "id": "AC-P8-03",
      "phase": "P8",
      "status": "Blocked",
      "source": "docs/roadmaps/ACCEPTANCE_MATRIX.md"
    },
    {
      "id": "AC-P9-01",
      "phase": "P9",
      "status": "Not Started",
      "source": "docs/roadmaps/ACCEPTANCE_MATRIX.md"
    },
    {
      "id": "AC-P9-02",
      "phase": "P9",
      "status": "Blocked",
      "source": "docs/roadmaps/ACCEPTANCE_MATRIX.md"
    },
    {
      "id": "AC-P10-01",
      "phase": "P10",
      "status": "Blocked",
      "source": "docs/roadmaps/ACCEPTANCE_MATRIX.md"
    },
    {
      "id": "AC-P10-02",
      "phase": "P10",
      "status": "Blocked",
      "source": "docs/roadmaps/ACCEPTANCE_MATRIX.md"
    },
    {
      "id": "AC-P10-03",
      "phase": "P10",
      "status": "Blocked",
      "source": "docs/roadmaps/ACCEPTANCE_MATRIX.md"
    },
    {
      "id": "AC-P11-01",
      "phase": "P11",
      "status": "Blocked",
      "source": "docs/roadmaps/ACCEPTANCE_MATRIX.md"
    },
    {
      "id": "AC-P11-02",
      "phase": "P11",
      "status": "Blocked",
      "source": "docs/roadmaps/ACCEPTANCE_MATRIX.md"
    },
    {
      "id": "AC-P11-03",
      "phase": "P11",
      "status": "Blocked",
      "source": "docs/roadmaps/ACCEPTANCE_MATRIX.md"
    },
    {
      "id": "AC-P12-01",
      "phase": "P12",
      "status": "Blocked",
      "source": "docs/roadmaps/ACCEPTANCE_MATRIX.md"
    },
    {
      "id": "AC-P12-02",
      "phase": "P12",
      "status": "Blocked",
      "source": "docs/roadmaps/ACCEPTANCE_MATRIX.md"
    },
    {
      "id": "AC-P12-03",
      "phase": "P12",
      "status": "Blocked",
      "source": "docs/roadmaps/ACCEPTANCE_MATRIX.md"
    },
    {
      "id": "AC-P12-04",
      "phase": "P12",
      "status": "Blocked",
      "source": "docs/roadmaps/ACCEPTANCE_MATRIX.md"
    },
    {
      "id": "AC-P12-05",
      "phase": "P12",
      "status": "Blocked",
      "source": "docs/roadmaps/ACCEPTANCE_MATRIX.md"
    },
    {